classification,school,address,phone,website,cre-url,grade,type,programs,about-1,about-2,about-3,snippet_name,school_name,cre-url,cre_markup
public,Roland Michener School,"5958 4 Ave NE Calgary, AB T2A 4B1",403-777-8240,http://school.cbe.ab.ca/school/RolandMichener/,,K to 5,Elementary,Regular,"<p>A community-oriented school that is distinguished for its cultural diversity, Roland Michener School serves the northeast community of Marlborough Park. The elementary school provides Kindergarten to Grade 5, straight grade and multi-aged classrooms and Paced Learning Programs (PLP) as well.</p>",,,public-roland-michener-school,roland-michener-school,/uploads/agent-1/optimized-images/school-logos/public/roland-michener-school.webp,"<div class='cmty-school'> <div class='cmty-school__text'> <h3>Roland Michener School</h3> <p>5958 4 Ave NE Calgary, AB T2A 4B1</p><p><strong>Phone Number:</strong> 403-777-8240</p></div><div class='cmty-school__info'> <a href='http://school.cbe.ab.ca/school/RolandMichener/' target='_blank' rel='nofollow noreferrer noindex'> <img class='lazyload' data-src='/uploads/agent-1/optimized-images/school-logos/public/roland-michener-school.webp' alt='Roland Michener School Logo' width='80' height='80' title='Visit Roland Michener School website.'> </a> <div> <p><strong>Grades:</strong> K to 5</p><p><strong>Type:</strong> Elementary</p><p><strong>Programs:</strong> Regular</p></div></div><div class='cmty-school__icons'> <img class='more-info lazyload' data-src='/uploads/agent-1/community/info.svg' title='More Info' alt='More Info about Roland Michener School' height='30' width='30'> </div><div class='cmty-school__content'> <h4>About Roland Michener School</h4><p>A community-oriented school that is distinguished for its cultural diversity, Roland Michener School serves the northeast community of Marlborough Park. The elementary school provides Kindergarten to Grade 5, straight grade and multi-aged classrooms and Paced Learning Programs (PLP) as well.</p></div></div>"
public,Dr. Gladys McKelvie Egbert School,"6033 Madigan Dr NE Calgary, AB T2A 5G9",403-777-7780,http://school.cbe.ab.ca/school/drgmegbert,,9-Jun,Middle,Regular,"<p>One of the main goals of Dr. Gladys McKelvie Egbert School is to facilitate its middle students developing independent learning capabilities. Their robust learning programs are bolstered with optional courses in leadership, industrial arts, multi-media (computers), French, drama, dance, guitar and, drumming.</p>",,,public-dr-gladys-mckelvie-egbert-school,dr-gladys-mckelvie-egbert-school,/uploads/agent-1/optimized-images/school-logos/public/dr-gladys-mckelvie-egbert-school.webp,"<div class='cmty-school'> <div class='cmty-school__text'> <h3>Dr. Gladys McKelvie Egbert School</h3> <p>6033 Madigan Dr NE Calgary, AB T2A 5G9</p><p><strong>Phone Number:</strong> 403-777-7780</p></div><div class='cmty-school__info'> <a href='http://school.cbe.ab.ca/school/drgmegbert' target='_blank' rel='nofollow noreferrer noindex'> <img class='lazyload' data-src='/uploads/agent-1/optimized-images/school-logos/public/dr-gladys-mckelvie-egbert-school.webp' alt='Dr. Gladys McKelvie Egbert School Logo' width='80' height='80' title='Visit Dr. Gladys McKelvie Egbert School website.'> </a> <div> <p><strong>Grades:</strong> 6 - 9</p><p><strong>Type:</strong> Middle</p><p><strong>Programs:</strong> Regular</p></div></div><div class='cmty-school__icons'> <img class='more-info lazyload' data-src='/uploads/agent-1/community/info.svg' title='More Info' alt='More Info about Dr. Gladys McKelvie Egbert School' height='30' width='30'> </div><div class='cmty-school__content'> <h4>About Dr. Gladys McKelvie Egbert School</h4><p>One of the main goals of Dr. Gladys McKelvie Egbert School is to facilitate its middle students developing independent learning capabilities. Their robust learning programs are bolstered with optional courses in leadership, industrial arts, multi-media (computers), French, drama, dance, guitar and, drumming.</p></div></div>"
public,Manmeet Singh Bhullar School,"1027 Martindale Blvd NE Calgary, AB T3J 4Z1",403-817-3568,http://school.cbe.ab.ca/school/ManmeetSinghBhullar,,K to 5,Elementary,Regular,"<p>Creating a safe, caring and holistic learning environment, Manmeet Singh Bhullar School motivates its students to excel academically while providing them with ample opportunities to develop their personal talents and capabilities. Students are encouraged to achieve challenging personal goals with a “Can do” attitude.</p>",,,public-manmeet-singh-bhullar-school,manmeet-singh-bhullar-school,/uploads/agent-1/optimized-images/school-logos/public/manmeet-singh-bhullar-school.webp,"<div class='cmty-school'> <div class='cmty-school__text'> <h3>Manmeet Singh Bhullar School</h3> <p>1027 Martindale Blvd NE Calgary, AB T3J 4Z1</p><p><strong>Phone Number:</strong> 403-817-3568</p></div><div class='cmty-school__info'> <a href='http://school.cbe.ab.ca/school/ManmeetSinghBhullar' target='_blank' rel='nofollow noreferrer noindex'> <img class='lazyload' data-src='/uploads/agent-1/optimized-images/school-logos/public/manmeet-singh-bhullar-school.webp' alt='Manmeet Singh Bhullar School Logo' width='80' height='80' title='Visit Manmeet Singh Bhullar School website.'> </a> <div> <p><strong>Grades:</strong> K to 5</p><p><strong>Type:</strong> Elementary</p><p><strong>Programs:</strong> Regular</p></div></div><div class='cmty-school__icons'> <img class='more-info lazyload' data-src='/uploads/agent-1/community/info.svg' title='More Info' alt='More Info about Manmeet Singh Bhullar School' height='30' width='30'> </div><div class='cmty-school__content'> <h4>About Manmeet Singh Bhullar School</h4><p>Creating a safe, caring and holistic learning environment, Manmeet Singh Bhullar School motivates its students to excel academically while providing them with ample opportunities to develop their personal talents and capabilities. Students are encouraged to achieve challenging personal goals with a “Can do” attitude.</p></div></div>"
public,Crossing Park School,"500 Martindale Blvd NE Calgary, AB T3J 4W8",403-777-7195,http://school.cbe.ab.ca/school/CrossingPark/,,K to 9,Elementary/Junior,Regular,"<p>Founded in 2000 as a mini-school for Kindergarten and Grade 1, today Crossing Park School is a large learning community that offers comprehensive learning programs and extracurricular programs up to Grade 9. They focus on driving academic excellence while enhancing social and emotional growth.</p>",,,public-crossing-park-school,crossing-park-school,/uploads/agent-1/optimized-images/school-logos/public/crossing-park-school.webp,"<div class='cmty-school'> <div class='cmty-school__text'> <h3>Crossing Park School</h3> <p>500 Martindale Blvd NE Calgary, AB T3J 4W8</p><p><strong>Phone Number:</strong> 403-777-7195</p></div><div class='cmty-school__info'> <a href='http://school.cbe.ab.ca/school/CrossingPark/' target='_blank' rel='nofollow noreferrer noindex'> <img class='lazyload' data-src='/uploads/agent-1/optimized-images/school-logos/public/crossing-park-school.webp' alt='Crossing Park School Logo' width='80' height='80' title='Visit Crossing Park School website.'> </a> <div> <p><strong>Grades:</strong> K to 9</p><p><strong>Type:</strong> Elementary/Junior</p><p><strong>Programs:</strong> Regular</p></div></div><div class='cmty-school__icons'> <img class='more-info lazyload' data-src='/uploads/agent-1/community/info.svg' title='More Info' alt='More Info about Crossing Park School' height='30' width='30'> </div><div class='cmty-school__content'> <h4>About Crossing Park School</h4><p>Founded in 2000 as a mini-school for Kindergarten and Grade 1, today Crossing Park School is a large learning community that offers comprehensive learning programs and extracurricular programs up to Grade 9. They focus on driving academic excellence while enhancing social and emotional growth.</p></div></div>"
public,Belfast School,"1229 17A St NE Calgary, AB T2E 4V4",403-777-6250,http://school.cbe.ab.ca/school/belfast,,K to 6,Elementary,Regular,"<p>Belfast School provides a community-oriented learning environment, which includes Fine Arts Instructional Blocks – Visual Arts, Musical Theatre, Drama, Dance and, Creative Choice. The learning programs are bolstered by a strong support system - The Belfast School Council, which is actively involved in the Mentorship Program.</p>",,,public-belfast-school,belfast-school,/uploads/agent-1/optimized-images/school-logos/public/belfast-school.webp,"<div class='cmty-school'> <div class='cmty-school__text'> <h3>Belfast School</h3> <p>1229 17A St NE Calgary, AB T2E 4V4</p><p><strong>Phone Number:</strong> 403-777-6250</p></div><div class='cmty-school__info'> <a href='http://school.cbe.ab.ca/school/belfast' target='_blank' rel='nofollow noreferrer noindex'> <img class='lazyload' data-src='/uploads/agent-1/optimized-images/school-logos/public/belfast-school.webp' alt='Belfast School Logo' width='80' height='80' title='Visit Belfast School website.'> </a> <div> <p><strong>Grades:</strong> K to 6</p><p><strong>Type:</strong> Elementary</p><p><strong>Programs:</strong> Regular</p></div></div><div class='cmty-school__icons'> <img class='more-info lazyload' data-src='/uploads/agent-1/community/info.svg' title='More Info' alt='More Info about Belfast School' height='30' width='30'> </div><div class='cmty-school__content'> <h4>About Belfast School</h4><p>Belfast School provides a community-oriented learning environment, which includes Fine Arts Instructional Blocks – Visual Arts, Musical Theatre, Drama, Dance and, Creative Choice. The learning programs are bolstered by a strong support system - The Belfast School Council, which is actively involved in the Mentorship Program.</p></div></div>"
public,Mayland Heights School,"2324 Maunsell Dr NE Calgary, AB T2E 6A2",403-777-6290,http://school.cbe.ab.ca/school/maylandheights/,,K to 6,Elementary," Regular, Early French Immersion","<p>An excellent elementary learning community, Mayland Heights School offers both regular and Early French Immersion programs. Their main objective is to provide its students with enriched learning experiences and motivate them to become responsible, caring, self-reliant and contributing members of society.</p>",,,public-mayland-heights-school,mayland-heights-school,/uploads/agent-1/optimized-images/school-logos/public/mayland-heights-school.webp,"<div class='cmty-school'> <div class='cmty-school__text'> <h3>Mayland Heights School</h3> <p>2324 Maunsell Dr NE Calgary, AB T2E 6A2</p><p><strong>Phone Number:</strong> 403-777-6290</p></div><div class='cmty-school__info'> <a href='http://school.cbe.ab.ca/school/maylandheights/' target='_blank' rel='nofollow noreferrer noindex'> <img class='lazyload' data-src='/uploads/agent-1/optimized-images/school-logos/public/mayland-heights-school.webp' alt='Mayland Heights School Logo' width='80' height='80' title='Visit Mayland Heights School website.'> </a> <div> <p><strong>Grades:</strong> K to 6</p><p><strong>Type:</strong> Elementary</p><p><strong>Programs:</strong>  Regular, Early French Immersion</p></div></div><div class='cmty-school__icons'> <img class='more-info lazyload' data-src='/uploads/agent-1/community/info.svg' title='More Info' alt='More Info about Mayland Heights School' height='30' width='30'> </div><div class='cmty-school__content'> <h4>About Mayland Heights School</h4><p>An excellent elementary learning community, Mayland Heights School offers both regular and Early French Immersion programs. Their main objective is to provide its students with enriched learning experiences and motivate them to become responsible, caring, self-reliant and contributing members of society.</p></div></div>"
public,Sir John Franklin School,"2215 8 Ave NE Calgary, AB T2E 0T7",403-777-7610,http://school.cbe.ab.ca/school/SirJohnFranklin/,, 5 to 9,Middle,Arts-Centred,"<p>Situated in northeast Mayland Heights, Sir John Franklin School is the north campus for the Arts-Centered Learning (ACL) alternative program and serves Grade 5 – 9 students in Areas 1, II and III, with many of them belonging to communities north of the Bow River.</p>",,,public-sir-john-franklin-school,sir-john-franklin-school,/uploads/agent-1/optimized-images/school-logos/public/sir-john-franklin-school.webp,"<div class='cmty-school'> <div class='cmty-school__text'> <h3>Sir John Franklin School</h3> <p>2215 8 Ave NE Calgary, AB T2E 0T7</p><p><strong>Phone Number:</strong> 403-777-7610</p></div><div class='cmty-school__info'> <a href='http://school.cbe.ab.ca/school/SirJohnFranklin/' target='_blank' rel='nofollow noreferrer noindex'> <img class='lazyload' data-src='/uploads/agent-1/optimized-images/school-logos/public/sir-john-franklin-school.webp' alt='Sir John Franklin School Logo' width='80' height='80' title='Visit Sir John Franklin School website.'> </a> <div> <p><strong>Grades:</strong>  5 to 9</p><p><strong>Type:</strong> Middle</p><p><strong>Programs:</strong> Arts-Centred</p></div></div><div class='cmty-school__icons'> <img class='more-info lazyload' data-src='/uploads/agent-1/community/info.svg' title='More Info' alt='More Info about Sir John Franklin School' height='30' width='30'> </div><div class='cmty-school__content'> <h4>About Sir John Franklin School</h4><p>Situated in northeast Mayland Heights, Sir John Franklin School is the north campus for the Arts-Centered Learning (ACL) alternative program and serves Grade 5 – 9 students in Areas 1, II and III, with many of them belonging to communities north of the Bow River.</p></div></div>"
public,Colonel Macleod School,"1610 6 St NE Calgary, AB T2E 3Y9",403-777-7500,http://school.cbe.ab.ca/school/colonelmacleod/,,5 to 9,Middle,"Regular, Traditional Learning Centre (TLC)","<p>Located in the beautiful community of Renfrew in northwest Calgary, the Colonel Macleod School has a major chunk of its student community enrolled in the Traditional Learning Centre program. The school accepts students from Winston Heights, Regal Terrace and Renfrew.</p>",,,public-colonel-macleod-school,colonel-macleod-school,/uploads/agent-1/optimized-images/school-logos/public/colonel-macleod-school.webp,"<div class='cmty-school'> <div class='cmty-school__text'> <h3>Colonel Macleod School</h3> <p>1610 6 St NE Calgary, AB T2E 3Y9</p><p><strong>Phone Number:</strong> 403-777-7500</p></div><div class='cmty-school__info'> <a href='http://school.cbe.ab.ca/school/colonelmacleod/' target='_blank' rel='nofollow noreferrer noindex'> <img class='lazyload' data-src='/uploads/agent-1/optimized-images/school-logos/public/colonel-macleod-school.webp' alt='Colonel Macleod School Logo' width='80' height='80' title='Visit Colonel Macleod School website.'> </a> <div> <p><strong>Grades:</strong> 5 to 9</p><p><strong>Type:</strong> Middle</p><p><strong>Programs:</strong> Regular, Traditional Learning Centre (TLC)</p></div></div><div class='cmty-school__icons'> <img class='more-info lazyload' data-src='/uploads/agent-1/community/info.svg' title='More Info' alt='More Info about Colonel Macleod School' height='30' width='30'> </div><div class='cmty-school__content'> <h4>About Colonel Macleod School</h4><p>Located in the beautiful community of Renfrew in northwest Calgary, the Colonel Macleod School has a major chunk of its student community enrolled in the Traditional Learning Centre program. The school accepts students from Winston Heights, Regal Terrace and Renfrew.</p></div></div>"
public,Monterey Park School,"7400 California Blvd NE Calgary, AB T1Y 6R2", 403-777-7233,http://school.cbe.ab.ca/school/montereypark/,,K to 6,Elementary,Regular,"<p>At Monterey Park School, the vision of the faculty is to encourage the students to create their own unique ideas, artefacts and life experiences that can help them learn and achieve their goals in the context of the 21st century.</p>",,,public-monterey-park-school,monterey-park-school,/uploads/agent-1/optimized-images/school-logos/public/monterey-park-school.webp,"<div class='cmty-school'> <div class='cmty-school__text'> <h3>Monterey Park School</h3> <p>7400 California Blvd NE Calgary, AB T1Y 6R2</p><p><strong>Phone Number:</strong>  403-777-7233</p></div><div class='cmty-school__info'> <a href='http://school.cbe.ab.ca/school/montereypark/' target='_blank' rel='nofollow noreferrer noindex'> <img class='lazyload' data-src='/uploads/agent-1/optimized-images/school-logos/public/monterey-park-school.webp' alt='Monterey Park School Logo' width='80' height='80' title='Visit Monterey Park School website.'> </a> <div> <p><strong>Grades:</strong> K to 6</p><p><strong>Type:</strong> Elementary</p><p><strong>Programs:</strong> Regular</p></div></div><div class='cmty-school__icons'> <img class='more-info lazyload' data-src='/uploads/agent-1/community/info.svg' title='More Info' alt='More Info about Monterey Park School' height='30' width='30'> </div><div class='cmty-school__content'> <h4>About Monterey Park School</h4><p>At Monterey Park School, the vision of the faculty is to encourage the students to create their own unique ideas, artefacts and life experiences that can help them learn and achieve their goals in the context of the 21st century.</p></div></div>"
public,Clarence Sansom School,"5840 24 Ave NE Calgary, AB T1Y 6G4", 403-777-7700,http://school.cbe.ab.ca/school/clarencesansom/,, 7 to 9,Junior,Regular,"<p>Since opening its doors in May, 1984, the Clarence Sansom School has emerged as one of the most prominent schools in this part of the city. The school is represented by white, orange and blue colours.</p>",,,public-clarence-sansom-school,clarence-sansom-school,/uploads/agent-1/optimized-images/school-logos/public/clarence-sansom-school.webp,"<div class='cmty-school'> <div class='cmty-school__text'> <h3>Clarence Sansom School</h3> <p>5840 24 Ave NE Calgary, AB T1Y 6G4</p><p><strong>Phone Number:</strong>  403-777-7700</p></div><div class='cmty-school__info'> <a href='http://school.cbe.ab.ca/school/clarencesansom/' target='_blank' rel='nofollow noreferrer noindex'> <img class='lazyload' data-src='/uploads/agent-1/optimized-images/school-logos/public/clarence-sansom-school.webp' alt='Clarence Sansom School Logo' width='80' height='80' title='Visit Clarence Sansom School website.'> </a> <div> <p><strong>Grades:</strong>  7 to 9</p><p><strong>Type:</strong> Junior</p><p><strong>Programs:</strong> Regular</p></div></div><div class='cmty-school__icons'> <img class='more-info lazyload' data-src='/uploads/agent-1/community/info.svg' title='More Info' alt='More Info about Clarence Sansom School' height='30' width='30'> </div><div class='cmty-school__content'> <h4>About Clarence Sansom School</h4><p>Since opening its doors in May, 1984, the Clarence Sansom School has emerged as one of the most prominent schools in this part of the city. The school is represented by white, orange and blue colours.</p></div></div>"
public,Lester B. Pearson High School,"3020 52 St NE Calgary, AB T1Y 5P4",403-280-6565,http://school.cbe.ab.ca/school/lesterbpearson/,,10 to 12,Senior,"Regular, Dual Credit, Early French Immersion, International Baccalaureate (IB), Late French Immersion, Off Campus Work Experience","<p>Situated in the north east quadrant of Calgary, Lester B. Pearson High School accepts students from the surrounding neighbourhoods of Monterey Park, Whitehorn, Temple, Rundle and Pineridge.</p>",,,public-lester-b-pearson-high-school,lester-b-pearson-high-school,/uploads/agent-1/optimized-images/school-logos/public/lester-b-pearson-high-school.webp,"<div class='cmty-school'> <div class='cmty-school__text'> <h3>Lester B. Pearson High School</h3> <p>3020 52 St NE Calgary, AB T1Y 5P4</p><p><strong>Phone Number:</strong> 403-280-6565</p></div><div class='cmty-school__info'> <a href='http://school.cbe.ab.ca/school/lesterbpearson/' target='_blank' rel='nofollow noreferrer noindex'> <img class='lazyload' data-src='/uploads/agent-1/optimized-images/school-logos/public/lester-b-pearson-high-school.webp' alt='Lester B. Pearson High School Logo' width='80' height='80' title='Visit Lester B. Pearson High School website.'> </a> <div> <p><strong>Grades:</strong> 10 to 12</p><p><strong>Type:</strong> Senior</p><p><strong>Programs:</strong> Regular, Dual Credit, Early French Immersion, International Baccalaureate (IB), Late French Immersion, Off Campus Work Experience</p></div></div><div class='cmty-school__icons'> <img class='more-info lazyload' data-src='/uploads/agent-1/community/info.svg' title='More Info' alt='More Info about Lester B. Pearson High School' height='30' width='30'> </div><div class='cmty-school__content'> <h4>About Lester B. Pearson High School</h4><p>Situated in the north east quadrant of Calgary, Lester B. Pearson High School accepts students from the surrounding neighbourhoods of Monterey Park, Whitehorn, Temple, Rundle and Pineridge.</p></div></div>"
public,Douglas Harkness School,"1116 3800 Memorial Drive NE Calgary, AB T2A 2K2",403-777-8384,http://school.cbe.ab.ca/school/DouglasHarkness/,,K to 6,Elementary,Regular,"<p>Serving students from Kindergarten to Grade 6, the Douglas Harkness School provides a well-balanced literacy instruction program that encourages students to develop problem solving skills through inquiry-based learning.</p>",,,public-douglas-harkness-school,douglas-harkness-school,/uploads/agent-1/optimized-images/school-logos/public/douglas-harkness-school.webp,"<div class='cmty-school'> <div class='cmty-school__text'> <h3>Douglas Harkness School</h3> <p>1116 3800 Memorial Drive NE Calgary, AB T2A 2K2</p><p><strong>Phone Number:</strong> 403-777-8384</p></div><div class='cmty-school__info'> <a href='http://school.cbe.ab.ca/school/DouglasHarkness/' target='_blank' rel='nofollow noreferrer noindex'> <img class='lazyload' data-src='/uploads/agent-1/optimized-images/school-logos/public/douglas-harkness-school.webp' alt='Douglas Harkness School Logo' width='80' height='80' title='Visit Douglas Harkness School website.'> </a> <div> <p><strong>Grades:</strong> K to 6</p><p><strong>Type:</strong> Elementary</p><p><strong>Programs:</strong> Regular</p></div></div><div class='cmty-school__icons'> <img class='more-info lazyload' data-src='/uploads/agent-1/community/info.svg' title='More Info' alt='More Info about Douglas Harkness School' height='30' width='30'> </div><div class='cmty-school__content'> <h4>About Douglas Harkness School</h4><p>Serving students from Kindergarten to Grade 6, the Douglas Harkness School provides a well-balanced literacy instruction program that encourages students to develop problem solving skills through inquiry-based learning.</p></div></div>"
public,Pineridge School,"1927 61 St NE Calgary, AB T1Y 4W6",403-777-6750,http://school.cbe.ab.ca/school/Pineridge,,K to 6,Elementary,Regular,"<p>Located in the neighbourhood of Pineridge in the northeast quadrant of Calgary, the Pineridge School is a multi-age classroom institution where 37.4% of the students are English language learners, 26.3% are students with special education needs and 9.7% are Aboriginal learners.</p>",,,public-pineridge-school,pineridge-school,/uploads/agent-1/optimized-images/school-logos/public/pineridge-school.webp,"<div class='cmty-school'> <div class='cmty-school__text'> <h3>Pineridge School</h3> <p>1927 61 St NE Calgary, AB T1Y 4W6</p><p><strong>Phone Number:</strong> 403-777-6750</p></div><div class='cmty-school__info'> <a href='http://school.cbe.ab.ca/school/Pineridge' target='_blank' rel='nofollow noreferrer noindex'> <img class='lazyload' data-src='/uploads/agent-1/optimized-images/school-logos/public/pineridge-school.webp' alt='Pineridge School Logo' width='80' height='80' title='Visit Pineridge School website.'> </a> <div> <p><strong>Grades:</strong> K to 6</p><p><strong>Type:</strong> Elementary</p><p><strong>Programs:</strong> Regular</p></div></div><div class='cmty-school__icons'> <img class='more-info lazyload' data-src='/uploads/agent-1/community/info.svg' title='More Info' alt='More Info about Pineridge School' height='30' width='30'> </div><div class='cmty-school__content'> <h4>About Pineridge School</h4><p>Located in the neighbourhood of Pineridge in the northeast quadrant of Calgary, the Pineridge School is a multi-age classroom institution where 37.4% of the students are English language learners, 26.3% are students with special education needs and 9.7% are Aboriginal learners.</p></div></div>"
