classification,school,address,phone,website,cre-url,grade,type,programs,about-1,about-2,about-3,snippet_name,school_name,cre-url,cre_markup
catholic,Guardian Angel School,"20 Aspen Hills Drive SW Calgary, AB T3H 0G5", 403-500-2111,https://guardianangel.cssd.ab.ca/,,K-6,Elementary,Regular Programming,"<p>A K-6 Catholic Elementary School, Guardian Angel boasts of a great location at 20 Aspen Hills Drive South West. Established in 2017, this school accepts students from Kindergarten through the sixth grade.</p>",,,catholic-guardian-angel-school,guardian-angel-school,/uploads/agent-1/optimized-images/school-logos/catholic/guardian-angel-school.webp,"<div class='cmty-school'> <div class='cmty-school__text'> <h3>Guardian Angel School</h3> <p>20 Aspen Hills Drive SW Calgary, AB T3H 0G5</p><p><strong>Phone Number:</strong>  403-500-2111</p></div><div class='cmty-school__info'> <a href='https://guardianangel.cssd.ab.ca/' target='_blank' rel='nofollow noreferrer noindex'> <img class='lazyload' data-src='/uploads/agent-1/optimized-images/school-logos/catholic/guardian-angel-school.webp' alt='Guardian Angel School Logo' width='80' height='80' title='Visit Guardian Angel School website.'> </a> <div> <p><strong>Grades:</strong> K-6</p><p><strong>Type:</strong> Elementary</p><p><strong>Programs:</strong> Regular Programming</p></div></div><div class='cmty-school__icons'> <img class='more-info lazyload' data-src='/uploads/agent-1/community/info.svg' title='More Info' alt='More Info about Guardian Angel School' height='30' width='30'> </div><div class='cmty-school__content'> <h4>About Guardian Angel School</h4><p>A K-6 Catholic Elementary School, Guardian Angel boasts of a great location at 20 Aspen Hills Drive South West. Established in 2017, this school accepts students from Kindergarten through the sixth grade.</p></div></div>"
catholic,Holy Angels School,"275 Riverglen Drive SE Calgary, AB T2C 3T5",403-500-2101,https://holyangels.cssd.ab.ca/,,K to 6,Elementary,Regular,"<p>Situated in the southeast Calgary community of Riverbend, the Holy Angels School is popular for its prime location that makes it conveniently accessible via Deerfoot Trail and Glenmore Trail.</p>",,,catholic-holy-angels-school,holy-angels-school,/uploads/agent-1/optimized-images/school-logos/catholic/holy-angels-school.webp,"<div class='cmty-school'> <div class='cmty-school__text'> <h3>Holy Angels School</h3> <p>275 Riverglen Drive SE Calgary, AB T2C 3T5</p><p><strong>Phone Number:</strong> 403-500-2101</p></div><div class='cmty-school__info'> <a href='https://holyangels.cssd.ab.ca/' target='_blank' rel='nofollow noreferrer noindex'> <img class='lazyload' data-src='/uploads/agent-1/optimized-images/school-logos/catholic/holy-angels-school.webp' alt='Holy Angels School Logo' width='80' height='80' title='Visit Holy Angels School website.'> </a> <div> <p><strong>Grades:</strong> K to 6</p><p><strong>Type:</strong> Elementary</p><p><strong>Programs:</strong> Regular</p></div></div><div class='cmty-school__icons'> <img class='more-info lazyload' data-src='/uploads/agent-1/community/info.svg' title='More Info' alt='More Info about Holy Angels School' height='30' width='30'> </div><div class='cmty-school__content'> <h4>About Holy Angels School</h4><p>Situated in the southeast Calgary community of Riverbend, the Holy Angels School is popular for its prime location that makes it conveniently accessible via Deerfoot Trail and Glenmore Trail.</p></div></div>"
catholic,Holy Child School,"31 Silverado Terrace SW Calgary, AB T2X 0K4",403-500-2130,https://holychild.cssd.ab.ca/,,K-9,Elementary / Junior High,Regular Programming,"<p>Holy Child School believes in promoting faith and inspired learning by accepting children as determined, curious and creative and encouraging spiritual and academic development through action and prayer.</p>",,,catholic-holy-child-school,holy-child-school,/uploads/agent-1/optimized-images/school-logos/catholic/holy-child-school.webp,"<div class='cmty-school'> <div class='cmty-school__text'> <h3>Holy Child School</h3> <p>31 Silverado Terrace SW Calgary, AB T2X 0K4</p><p><strong>Phone Number:</strong> 403-500-2130</p></div><div class='cmty-school__info'> <a href='https://holychild.cssd.ab.ca/' target='_blank' rel='nofollow noreferrer noindex'> <img class='lazyload' data-src='/uploads/agent-1/optimized-images/school-logos/catholic/holy-child-school.webp' alt='Holy Child School Logo' width='80' height='80' title='Visit Holy Child School website.'> </a> <div> <p><strong>Grades:</strong> K-9</p><p><strong>Type:</strong> Elementary / Junior High</p><p><strong>Programs:</strong> Regular Programming</p></div></div><div class='cmty-school__icons'> <img class='more-info lazyload' data-src='/uploads/agent-1/community/info.svg' title='More Info' alt='More Info about Holy Child School' height='30' width='30'> </div><div class='cmty-school__content'> <h4>About Holy Child School</h4><p>Holy Child School believes in promoting faith and inspired learning by accepting children as determined, curious and creative and encouraging spiritual and academic development through action and prayer.</p></div></div>"
catholic,Holy Cross School,"3719 - 26 Avenue SE Calgary, AB T2B 0C6",403-500-2033,https://holycross.cssd.ab.ca/,,K - 9,Elementary / Junior High,"ELL Preschool, Regular Programming","<p>A part of the Calgary Catholic School District, the Holy Cross School serves around 430 students from Kindergarten to the Ninth Grade. Located in the community of Greater Forest Lawn, this school believes in the holistic development of its students based on academics and faith.</p>",,,catholic-holy-cross-school,holy-cross-school,/uploads/agent-1/optimized-images/school-logos/catholic/holy-cross-school.webp,"<div class='cmty-school'> <div class='cmty-school__text'> <h3>Holy Cross School</h3> <p>3719 - 26 Avenue SE Calgary, AB T2B 0C6</p><p><strong>Phone Number:</strong> 403-500-2033</p></div><div class='cmty-school__info'> <a href='https://holycross.cssd.ab.ca/' target='_blank' rel='nofollow noreferrer noindex'> <img class='lazyload' data-src='/uploads/agent-1/optimized-images/school-logos/catholic/holy-cross-school.webp' alt='Holy Cross School Logo' width='80' height='80' title='Visit Holy Cross School website.'> </a> <div> <p><strong>Grades:</strong> K - 9</p><p><strong>Type:</strong> Elementary / Junior High</p><p><strong>Programs:</strong> ELL Preschool, Regular Programming</p></div></div><div class='cmty-school__icons'> <img class='more-info lazyload' data-src='/uploads/agent-1/community/info.svg' title='More Info' alt='More Info about Holy Cross School' height='30' width='30'> </div><div class='cmty-school__content'> <h4>About Holy Cross School</h4><p>A part of the Calgary Catholic School District, the Holy Cross School serves around 430 students from Kindergarten to the Ninth Grade. Located in the community of Greater Forest Lawn, this school believes in the holistic development of its students based on academics and faith.</p></div></div>"
catholic,Holy Family School,"904 - 32 Street SE Calgary, AB T2A 0Z1",403-500-2054,https://holyfamily.cssd.ab.ca/,,K-6,Elementary,Regular Programming,"<p>Located in the Radisson Heights community, the Holy Family School serves students from Kindergarten through Grade 6 and welcomes enthusiastic learners from the Alberta Park/Radisson Heights neighbourhoods.</p>",,,catholic-holy-family-school,holy-family-school,/uploads/agent-1/optimized-images/school-logos/catholic/holy-family-school.webp,"<div class='cmty-school'> <div class='cmty-school__text'> <h3>Holy Family School</h3> <p>904 - 32 Street SE Calgary, AB T2A 0Z1</p><p><strong>Phone Number:</strong> 403-500-2054</p></div><div class='cmty-school__info'> <a href='https://holyfamily.cssd.ab.ca/' target='_blank' rel='nofollow noreferrer noindex'> <img class='lazyload' data-src='/uploads/agent-1/optimized-images/school-logos/catholic/holy-family-school.webp' alt='Holy Family School Logo' width='80' height='80' title='Visit Holy Family School website.'> </a> <div> <p><strong>Grades:</strong> K-6</p><p><strong>Type:</strong> Elementary</p><p><strong>Programs:</strong> Regular Programming</p></div></div><div class='cmty-school__icons'> <img class='more-info lazyload' data-src='/uploads/agent-1/community/info.svg' title='More Info' alt='More Info about Holy Family School' height='30' width='30'> </div><div class='cmty-school__content'> <h4>About Holy Family School</h4><p>Located in the Radisson Heights community, the Holy Family School serves students from Kindergarten through Grade 6 and welcomes enthusiastic learners from the Alberta Park/Radisson Heights neighbourhoods.</p></div></div>"
catholic,Holy Name School,"3011 - 35 Street SW Calgary, AB T3E 2Y7",403-500-2006,https://holyname.cssd.ab.ca/,,K-6,Elementary,French Immersion only,"<p>A French Immersion elementary school in the Calgary Catholic School District, Ecole Holy Name School is located in the Killarney community and welcomes students from around 50 different communities in South West Calgary.</p>",,,catholic-holy-name-school,holy-name-school,/uploads/agent-1/optimized-images/school-logos/catholic/holy-name-school.webp,"<div class='cmty-school'> <div class='cmty-school__text'> <h3>Holy Name School</h3> <p>3011 - 35 Street SW Calgary, AB T3E 2Y7</p><p><strong>Phone Number:</strong> 403-500-2006</p></div><div class='cmty-school__info'> <a href='https://holyname.cssd.ab.ca/' target='_blank' rel='nofollow noreferrer noindex'> <img class='lazyload' data-src='/uploads/agent-1/optimized-images/school-logos/catholic/holy-name-school.webp' alt='Holy Name School Logo' width='80' height='80' title='Visit Holy Name School website.'> </a> <div> <p><strong>Grades:</strong> K-6</p><p><strong>Type:</strong> Elementary</p><p><strong>Programs:</strong> French Immersion only</p></div></div><div class='cmty-school__icons'> <img class='more-info lazyload' data-src='/uploads/agent-1/community/info.svg' title='More Info' alt='More Info about Holy Name School' height='30' width='30'> </div><div class='cmty-school__content'> <h4>About Holy Name School</h4><p>A French Immersion elementary school in the Calgary Catholic School District, Ecole Holy Name School is located in the Killarney community and welcomes students from around 50 different communities in South West Calgary.</p></div></div>"
catholic,Holy Trinity School,"1717 - 41 Street SE Calgary, AB T2A 1L2",403-500-2032,https://holytrinity.cssd.ab.ca/,,K-6,Elementary, Regular Programming,"<p>Located in the SE community of Forest Lawn, the Holy Trinity School serves around 200 students from Kindergarten to the Sixth-grade classes</p>",,,catholic-holy-trinity-school,holy-trinity-school,/uploads/agent-1/optimized-images/school-logos/catholic/holy-trinity-school.webp,"<div class='cmty-school'> <div class='cmty-school__text'> <h3>Holy Trinity School</h3> <p>1717 - 41 Street SE Calgary, AB T2A 1L2</p><p><strong>Phone Number:</strong> 403-500-2032</p></div><div class='cmty-school__info'> <a href='https://holytrinity.cssd.ab.ca/' target='_blank' rel='nofollow noreferrer noindex'> <img class='lazyload' data-src='/uploads/agent-1/optimized-images/school-logos/catholic/holy-trinity-school.webp' alt='Holy Trinity School Logo' width='80' height='80' title='Visit Holy Trinity School website.'> </a> <div> <p><strong>Grades:</strong> K-6</p><p><strong>Type:</strong> Elementary</p><p><strong>Programs:</strong>  Regular Programming</p></div></div><div class='cmty-school__icons'> <img class='more-info lazyload' data-src='/uploads/agent-1/community/info.svg' title='More Info' alt='More Info about Holy Trinity School' height='30' width='30'> </div><div class='cmty-school__content'> <h4>About Holy Trinity School</h4><p>Located in the SE community of Forest Lawn, the Holy Trinity School serves around 200 students from Kindergarten to the Sixth-grade classes</p></div></div>"
catholic,John W. Costello Catholic School,"300 Strathcona Drive SW Calgary, AB T3H 1N9",403-500-2003,https://johncostello.cssd.ab.ca/,,K-6,Elementary, Regular Programming,"<p>Located in the community of Strathcona in Calgary, the John Costello Catholic School provides high quality Catholic and academic learning to students from Kindergarten through the sixth grade.</p>",,,catholic-john-w-costello-catholic-school,john-w-costello-catholic-school,/uploads/agent-1/optimized-images/school-logos/catholic/john-w-costello-catholic-school.webp,"<div class='cmty-school'> <div class='cmty-school__text'> <h3>John W. Costello Catholic School</h3> <p>300 Strathcona Drive SW Calgary, AB T3H 1N9</p><p><strong>Phone Number:</strong> 403-500-2003</p></div><div class='cmty-school__info'> <a href='https://johncostello.cssd.ab.ca/' target='_blank' rel='nofollow noreferrer noindex'> <img class='lazyload' data-src='/uploads/agent-1/optimized-images/school-logos/catholic/john-w-costello-catholic-school.webp' alt='John W. Costello Catholic School Logo' width='80' height='80' title='Visit John W. Costello Catholic School website.'> </a> <div> <p><strong>Grades:</strong> K-6</p><p><strong>Type:</strong> Elementary</p><p><strong>Programs:</strong>  Regular Programming</p></div></div><div class='cmty-school__icons'> <img class='more-info lazyload' data-src='/uploads/agent-1/community/info.svg' title='More Info' alt='More Info about John W. Costello Catholic School' height='30' width='30'> </div><div class='cmty-school__content'> <h4>About John W. Costello Catholic School</h4><p>Located in the community of Strathcona in Calgary, the John Costello Catholic School provides high quality Catholic and academic learning to students from Kindergarten through the sixth grade.</p></div></div>"
catholic,"John W. Costello Catholic School","300 Strathcona Drive SW Calgary, AB T3H 1N9",403-500-2003,https://johncostello.cssd.ab.ca/,,K-6,Elementary, Regular Programming,"<p>Located in the community of Strathcona in Calgary, the John Costello Catholic School provides high quality Catholic and academic learning to students from Kindergarten through the sixth grade.</p>",,,"catholic-john-w-costello-catholic-school","john-w-costello-catholic-school","/uploads/agent-1/optimized-images/school-logos/catholic/john-w-costello-catholic-school.webp","<div class='cmty-school'> <div class='cmty-school__text'> <h3>John W. Costello Catholic School</h3> <p>300 Strathcona Drive SW Calgary, AB T3H 1N9</p><p><strong>Phone Number:</strong> 403-500-2003</p></div><div class='cmty-school__info'> <a href='https://johncostello.cssd.ab.ca/' target='_blank' rel='nofollow noreferrer noindex'> <img class='lazyload' data-src='/uploads/agent-1/optimized-images/school-logos/catholic/john-w-costello-catholic-school.webp' alt='John W. Costello Catholic School Logo' width='80' height='80' title='Visit John W. Costello Catholic School website.'> </a> <div> <p><strong>Grades:</strong> K-6</p><p><strong>Type:</strong> Elementary</p><p><strong>Programs:</strong>  Regular Programming</p></div></div><div class='cmty-school__icons'> <img class='more-info lazyload' data-src='/uploads/agent-1/community/info.svg' title='More Info' alt='More Info about John W. Costello Catholic School' height='30' width='30'> </div><div class='cmty-school__content'> <h4>About John W. Costello Catholic School</h4><p>Located in the community of Strathcona in Calgary, the John Costello Catholic School provides high quality Catholic and academic learning to students from Kindergarten through the sixth grade.</p></div></div>"
catholic,Light of Christ School,"6270 Saddlehorn Drive NE Calgary, AB T3J 0L8",403-500-2121,https://lightofchrist.cssd.ab.ca/,, K-9,Elementary / Junior High,Regular Programming,<p>Light of Christ is both an Elementary and Junior High School serving the homes in Saddle Ridge and Savanna.</p>,,,catholic-light-of-christ-school,light-of-christ-school,/uploads/agent-1/optimized-images/school-logos/catholic/light-of-christ-school.webp,"<div class='cmty-school'> <div class='cmty-school__text'> <h3>Light of Christ School</h3> <p>6270 Saddlehorn Drive NE Calgary, AB T3J 0L8</p><p><strong>Phone Number:</strong> 403-500-2121</p></div><div class='cmty-school__info'> <a href='https://lightofchrist.cssd.ab.ca/' target='_blank' rel='nofollow noreferrer noindex'> <img class='lazyload' data-src='/uploads/agent-1/optimized-images/school-logos/catholic/light-of-christ-school.webp' alt='Light of Christ School Logo' width='80' height='80' title='Visit Light of Christ School website.'> </a> <div> <p><strong>Grades:</strong>  K-9</p><p><strong>Type:</strong> Elementary / Junior High</p><p><strong>Programs:</strong> Regular Programming</p></div></div><div class='cmty-school__icons'> <img class='more-info lazyload' data-src='/uploads/agent-1/community/info.svg' title='More Info' alt='More Info about Light of Christ School' height='30' width='30'> </div><div class='cmty-school__content'> <h4>About Light of Christ School</h4><p>Light of Christ is both an Elementary and Junior High School serving the homes in Saddle Ridge and Savanna.</p></div></div>"
catholic,Mother Mary Greene School,"115 Edenwold Drive NW Calgary, AB T3A 3S8",403-500-2095,https://mothermarygreene.cssd.ab.ca/,,K - 6,Elementary,Regular Programming,<p>The Mother Mary Greene School provides a safe and learning environment for its students and encourages its learners to develop a relationship with God by integrating Catholicity into its everyday activities.</p>,,,catholic-mother-mary-greene-school,mother-mary-greene-school,/uploads/agent-1/optimized-images/school-logos/catholic/mother-mary-greene-school.webp,"<div class='cmty-school'> <div class='cmty-school__text'> <h3>Mother Mary Greene School</h3> <p>115 Edenwold Drive NW Calgary, AB T3A 3S8</p><p><strong>Phone Number:</strong> 403-500-2095</p></div><div class='cmty-school__info'> <a href='https://mothermarygreene.cssd.ab.ca/' target='_blank' rel='nofollow noreferrer noindex'> <img class='lazyload' data-src='/uploads/agent-1/optimized-images/school-logos/catholic/mother-mary-greene-school.webp' alt='Mother Mary Greene School Logo' width='80' height='80' title='Visit Mother Mary Greene School website.'> </a> <div> <p><strong>Grades:</strong> K - 6</p><p><strong>Type:</strong> Elementary</p><p><strong>Programs:</strong> Regular Programming</p></div></div><div class='cmty-school__icons'> <img class='more-info lazyload' data-src='/uploads/agent-1/community/info.svg' title='More Info' alt='More Info about Mother Mary Greene School' height='30' width='30'> </div><div class='cmty-school__content'> <h4>About Mother Mary Greene School</h4><p>The Mother Mary Greene School provides a safe and learning environment for its students and encourages its learners to develop a relationship with God by integrating Catholicity into its everyday activities.</p></div></div>"
catholic,Monsignor A.J. Hetherington School,"4 Coral Springs Blvd NE Calgary, AB T3J 3J3",403-500-2036,https://msgrhetherington.cssd.ab.ca/,, K-6,Elementary,"ELL Preschool, Regular Programming",<p>Striving to make a difference for school and community through excellence is the goal of this Catholic School.</p>,,,catholic-monsignor-aj-hetherington-school,monsignor-aj-hetherington-school,/uploads/agent-1/optimized-images/school-logos/catholic/monsignor-aj-hetherington-school.webp,"<div class='cmty-school'> <div class='cmty-school__text'> <h3>Monsignor A.J. Hetherington School</h3> <p>4 Coral Springs Blvd NE Calgary, AB T3J 3J3</p><p><strong>Phone Number:</strong> 403-500-2036</p></div><div class='cmty-school__info'> <a href='https://msgrhetherington.cssd.ab.ca/' target='_blank' rel='nofollow noreferrer noindex'> <img class='lazyload' data-src='/uploads/agent-1/optimized-images/school-logos/catholic/monsignor-aj-hetherington-school.webp' alt='Monsignor A.J. Hetherington School Logo' width='80' height='80' title='Visit Monsignor A.J. Hetherington School website.'> </a> <div> <p><strong>Grades:</strong>  K-6</p><p><strong>Type:</strong> Elementary</p><p><strong>Programs:</strong> ELL Preschool, Regular Programming</p></div></div><div class='cmty-school__icons'> <img class='more-info lazyload' data-src='/uploads/agent-1/community/info.svg' title='More Info' alt='More Info about Monsignor A.J. Hetherington School' height='30' width='30'> </div><div class='cmty-school__content'> <h4>About Monsignor A.J. Hetherington School</h4><p>Striving to make a difference for school and community through excellence is the goal of this Catholic School.</p></div></div>"
catholic,Monsignor E.L. Doyle School,"8887 Surfield Drive NW Calgary, AB T3L 1H6",403-500-2098,https://msgrdoyle.cssd.ab.ca/,,K-6,Elementary, Regular Programming,"<p>Nestled within the NW community of Scenic Acres, Monsignor E.L. Doyle School boasts of an idyllic location atop a hill that provides breath-taking views of the surrounding Rocky Mountain range.</p>",,,catholic-monsignor-el-doyle-school,monsignor-el-doyle-school,/uploads/agent-1/optimized-images/school-logos/catholic/monsignor-el-doyle-school.webp,"<div class='cmty-school'> <div class='cmty-school__text'> <h3>Monsignor E.L. Doyle School</h3> <p>8887 Surfield Drive NW Calgary, AB T3L 1H6</p><p><strong>Phone Number:</strong> 403-500-2098</p></div><div class='cmty-school__info'> <a href='https://msgrdoyle.cssd.ab.ca/' target='_blank' rel='nofollow noreferrer noindex'> <img class='lazyload' data-src='/uploads/agent-1/optimized-images/school-logos/catholic/monsignor-el-doyle-school.webp' alt='Monsignor E.L. Doyle School Logo' width='80' height='80' title='Visit Monsignor E.L. Doyle School website.'> </a> <div> <p><strong>Grades:</strong> K-6</p><p><strong>Type:</strong> Elementary</p><p><strong>Programs:</strong>  Regular Programming</p></div></div><div class='cmty-school__icons'> <img class='more-info lazyload' data-src='/uploads/agent-1/community/info.svg' title='More Info' alt='More Info about Monsignor E.L. Doyle School' height='30' width='30'> </div><div class='cmty-school__content'> <h4>About Monsignor E.L. Doyle School</h4><p>Nestled within the NW community of Scenic Acres, Monsignor E.L. Doyle School boasts of an idyllic location atop a hill that provides breath-taking views of the surrounding Rocky Mountain range.</p></div></div>"
catholic,Monsignor J.J. O'Brien School,"99 Bridlewood Road SW Calgary, AB T2Y 4J5","99 Bridlewood Road SW Calgary, AB T2Y 4J5",https://msgrobrien.cssd.ab.ca/,, K-9,Elementary / Junior High,Regular Programming,"<p>Ever since it opened its doors in 2002, the Monsignor J.J. O’Brien School has been catering to the holistic learning needs of students in the Bridlewood community through its specialized academic, athletic and fine arts programs.</p>",,,catholic-monsignor-jj-o-brien-school,monsignor-jj-o-brien-school,/uploads/agent-1/optimized-images/school-logos/catholic/monsignor-jj-o-brien-school.webp,"<div class='cmty-school'> <div class='cmty-school__text'> <h3>Monsignor J.J. O'Brien School</h3> <p>99 Bridlewood Road SW Calgary, AB T2Y 4J5</p><p><strong>Phone Number:</strong> 99 Bridlewood Road SW Calgary, AB T2Y 4J5</p></div><div class='cmty-school__info'> <a href='https://msgrobrien.cssd.ab.ca/' target='_blank' rel='nofollow noreferrer noindex'> <img class='lazyload' data-src='/uploads/agent-1/optimized-images/school-logos/catholic/monsignor-jj-o-brien-school.webp' alt='Monsignor J.J. O'Brien School Logo' width='80' height='80' title='Visit Monsignor J.J. O'Brien School website.'> </a> <div> <p><strong>Grades:</strong>  K-9</p><p><strong>Type:</strong> Elementary / Junior High</p><p><strong>Programs:</strong> Regular Programming</p></div></div><div class='cmty-school__icons'> <img class='more-info lazyload' data-src='/uploads/agent-1/community/info.svg' title='More Info' alt='More Info about Monsignor J.J. O'Brien School' height='30' width='30'> </div><div class='cmty-school__content'> <h4>About Monsignor J.J. O'Brien School</h4><p>Ever since it opened its doors in 2002, the Monsignor J.J. O’Brien School has been catering to the holistic learning needs of students in the Bridlewood community through its specialized academic, athletic and fine arts programs.</p></div></div>"
catholic,Monsignor J.S. Smith School,"2919 Douglasdale Blvd SE Calgary, AB T2Z 2H9",403-500-2069,https://msgrsmith.cssd.ab.ca/,, K-9,Elementary / Junior High,"Hockey Canada Skills Academy (Gr.7-9), Regular Programming","<p>Operational in the communities of Mahogany, Douglas Glen and Douglasdale, the Monsignor J.S. Smith School offers quality Catholic education to over 750 students from Kindergarten to Ninth Grade.</p>",,,catholic-monsignor-js-smith-school,monsignor-js-smith-school,/uploads/agent-1/optimized-images/school-logos/catholic/monsignor-js-smith-school.webp,"<div class='cmty-school'> <div class='cmty-school__text'> <h3>Monsignor J.S. Smith School</h3> <p>2919 Douglasdale Blvd SE Calgary, AB T2Z 2H9</p><p><strong>Phone Number:</strong> 403-500-2069</p></div><div class='cmty-school__info'> <a href='https://msgrsmith.cssd.ab.ca/' target='_blank' rel='nofollow noreferrer noindex'> <img class='lazyload' data-src='/uploads/agent-1/optimized-images/school-logos/catholic/monsignor-js-smith-school.webp' alt='Monsignor J.S. Smith School Logo' width='80' height='80' title='Visit Monsignor J.S. Smith School website.'> </a> <div> <p><strong>Grades:</strong>  K-9</p><p><strong>Type:</strong> Elementary / Junior High</p><p><strong>Programs:</strong> Hockey Canada Skills Academy (Gr.7-9), Regular Programming</p></div></div><div class='cmty-school__icons'> <img class='more-info lazyload' data-src='/uploads/agent-1/community/info.svg' title='More Info' alt='More Info about Monsignor J.S. Smith School' height='30' width='30'> </div><div class='cmty-school__content'> <h4>About Monsignor J.S. Smith School</h4><p>Operational in the communities of Mahogany, Douglas Glen and Douglasdale, the Monsignor J.S. Smith School offers quality Catholic education to over 750 students from Kindergarten to Ninth Grade.</p></div></div>"
